{
  "openbook_version": "0.2.0-draft",
  "sequence": 104902,
  "timestamp": "2026-09-19T13:05:00Z",
  "publisher": "acme-feeds",
  "fixture": "EVT-88213",
  "operation": "modify",
  "changes": {
    "start_time": "2026-09-19T14:15:00Z",
    "state": "scheduled",
    "x_reason": "kick-off delayed 15 minutes"
  }
}
